{
  "$schema": "https://c0nfig.vercel.app/cli/schema.json",
  "description": "Initialize Drizzle ORM and Drizzle Kit to your project",
  "title": "Drizzle ORM and Drizzle Kit",
  "version": 1.0,
  "operation": [
    {
      "op": "select",
      "title": "Select your database type",
      "selections": [
        {"label": "Turso (SQLite)", "value": "turso"},
        {"label": "Supabase", "value": "supabase"},
        {"label": "SQLite", "value": "sqlite"}
      ],
      "value": "$databaseType",
      "values": {
        "turso": [
          {
            "op": "add",
            "content": "import { defineConfig } from 'drizzle-kit';\n\nexport default defineConfig({\n  schema: '$absDbPath/schema.ts',\n  out: '$absDbPath/migrations',\n  dialect: 'sqlite',\n  driver: 'turso',\n  verbose: true,\n  strict: true,\n  dbCredentials: {\n    authToken: process.env.DATABASE_AUTH as string,\n    url: process.env.DATABASE_URL as string\n  }\n});",
            "targetSrc": "./drizzle.config.ts"
          },
          {
            "op": "add",
            "content": "import { drizzle } from 'drizzle-orm/libsql';\nimport { createClient } from '@libsql/client';\nexport * from \"./schema\";\n\nconst client = createClient({ url: process.env.VITE_DATABASE_URL, authToken: process.env.DATABASE_TOKEN });\nexport const db = drizzle(client);",
            "targetSrc": "~/db/index.ts"
          },
          {
            "op": "add",
            "content": "import { sqliteTable, text } from \"drizzle-orm/sqlite-core\";\n\nexport const users = sqliteTable('users', { id: text('id') });",
            "targetSrc": "~/db/schema.ts"
          },
          {"op": "install", "dep": ["@libsql/client"]},
          {
            "op": "updateJSON",
            "targetSrc": "./command.config.json",
            "path": "db.engine",
            "value": "sqlite"
          },
          {
            "op": "updateJSON",
            "targetSrc": "./command.config.json",
            "path": "db.name",
            "value": "turso"
          }
        ],
        "supabase": [
          {
            "op": "add",
            "content": "import { defineConfig } from 'drizzle-kit';\n\nexport default defineConfig({\n  schema: '$absDbPath/schema.ts',\n  out: '$absDbPath/migrations',\n  dialect: 'postgresql',\n  verbose: true,\n  strict: true,\n  dbCredentials: {\n    url: process.env.DATABASE_URL as string\n  }\n});",
            "targetSrc": "./drizzle.config.ts"
          },
          {
            "op": "add",
            "content": "import { drizzle } from 'drizzle-orm/postgres-js';\nimport postgres from 'postgres';\nexport * from \"./schema\";\n\nconst connectionString = process.env.DATABASE_URL;\nconst client = postgres(connectionString);\nexport const db = drizzle(client);",
            "targetSrc": "~/db/index.ts"
          },
          {
            "op": "add",
            "content": "import { pgTable, serial } from \"drizzle-orm/pg-core\";\n\nexport const users = pgTable('users', {\n  id: serial('id').primaryKey(),\n});",
            "targetSrc": "~/db/schema.ts"
          },
          {"op": "install", "dep": ["postgres"]},
          {
            "op": "updateJSON",
            "targetSrc": "./command.config.json",
            "path": "db.engine",
            "value": "postgres"
          },
          {
            "op": "updateJSON",
            "targetSrc": "./command.config.json",
            "path": "db.name",
            "value": "supabase"
          }
        ],
        "sqlite": [
          {
            "op": "add",
            "content": "import { defineConfig } from 'drizzle-kit';\n\nexport default defineConfig({\n  schema: '$absDbPath/schema.ts',\n  out: '$absDbPath/migrations',\n  dialect: 'sqlite',\n  verbose: true,\n  strict: true,\n  dbCredentials: {\n    url: 'sqlite.db'\n  }\n});",
            "targetSrc": "./drizzle.config.ts"
          },
          {
            "op": "add",
            "content": "import { drizzle } from 'drizzle-orm/better-sqlite3';\nexport * from \"./schema\";\n\nimport Database from 'better-sqlite3';\nconst sqlite = new Database('sqlite.db');\nexport const db = drizzle(sqlite);",
            "targetSrc": "~/db/index.ts"
          },
          {
            "op": "add",
            "content": "import { text, sqliteTable } from \"drizzle-orm/sqlite-core\";\n\nexport const users = sqliteTable('users', {\n  id: text('id'),\n});",
            "targetSrc": "~/db/schema.ts"
          },
          {"op": "install", "dep": ["better-sqlite3"]},
          {
            "op": "updateJSON",
            "targetSrc": "./command.config.json",
            "path": "db.engine",
            "value": "sqlite"
          },
          {
            "op": "updateJSON",
            "targetSrc": "./command.config.json",
            "path": "db.name",
            "value": "sqlite"
          }
        ]
      }
    },
    {
      "op": "updateJSON",
      "targetSrc": "./package.json",
      "path": "scripts.db:generate",
      "value": "drizzle-kit generate"
    },
    {
      "op": "updateJSON",
      "targetSrc": "./package.json",
      "path": "scripts.db:migrate",
      "value": "drizzle-kit migrate"
    },
    {
      "op": "updateJSON",
      "targetSrc": "./package.json",
      "path": "scripts.db:push",
      "value": "drizzle-kit push"
    },
    {
      "op": "install",
      "dep": ["drizzle-orm"],
      "devDep": ["drizzle-kit"]
    }
  ]
}
