{
  "$schema": "https://c0nfig.vercel.app/cli/schema.json",
  "description": "Initialize Lucia with Drizzle ORM",
  "title": "Lucia init",
  "version": 1.0,
  "operation": [
    {
      "op": "select",
      "title": "Select your auth type to add",
      "selections": [
        {"label": "Password", "value": "password"},
        {"label": "Google", "value": "google"},
        {"label": "Github", "value": "github"},
        {"label": "Discord", "value": "discord"}
      ],
      "value": "$authAdd",
      "values": {
        "password": [
          {
            "op": "add",
            "remoteSrc": "/assets/auth/options/password.ts",
            "targetSrc": "~/auth/options/password.ts"
          },
          {
            "op": "add-export",
            "targetSrc": "~/auth/options/index.ts",
            "content": "export * from './password'"
          },
          {
            "op": "install",
            "dep": ["zod"]
          }
        ],
        "google": [
          {
            "op": "add",
            "remoteSrc": "/assets/auth/options/google.ts",
            "targetSrc": "~/auth/options/google.ts"
          },
          {
            "op": "add-export",
            "targetSrc": "~/auth/options/index.ts",
            "content": "export * from './google'"
          }
        ],
        "github": [
          {
            "op": "add",
            "remoteSrc": "/assets/auth/options/github.ts",
            "targetSrc": "~/auth/options/github.ts"
          },
          {
            "op": "add-export",
            "targetSrc": "~/auth/options/index.ts",
            "content": "export * from './github'"
          }
        ],
        "discord": [
          {
            "op": "add",
            "remoteSrc": "/assets/auth/options/discord.ts",
            "targetSrc": "~/auth/options/discord.ts"
          },
          {
            "op": "add-export",
            "targetSrc": "~/auth/options/index.ts",
            "content": "export * from './discord'"
          }
        ]
      }
    }
  ]
}
