{
  "$schema": "https://c0nfig.vercel.app/cli/schema.json",
  "description": "Init your c0nfig framework",
  "title": "Init c0nfig",
  "version": 1.0,
  "operation": [
    {
      "op": "input",
      "title": "Which is your source directory",
      "defaultValue": "./src/*",
      "value": "$aliases",
      "actions": [
        {
          "op": "add",
          "content": "{}",
          "targetSrc": "./command.config.json"
        },
        {
          "op": "updateJSON",
          "targetSrc": "./command.config.json",
          "path": "aliases.path",
          "value": "$aliases"
        },
        {
          "op": "updateJSON",
          "targetSrc": "./package.json",
          "path": "imports.~/*",
          "value": "$aliases"
        },
        {
          "op": "updateJSON",
          "targetSrc": "./package.json",
          "path": "compilerOptions.paths.~/*[0]",
          "value": "./modules/*"
        }
      ]
    },
    {
      "op": "select",
      "title": "Select you package manager",
      "selections": [
        {"label": "npm", "value": "npm"},
        {"label": "pnpm", "value": "pnpm"},
        {"label": "yarn", "value": "yarn"}
      ],
      "value": "$packageManager",
      "values": {
        "npm": [
          {
            "op": "updateJSON",
            "targetSrc": "./command.config.json",
            "path": "packageManager",
            "value": "npm"
          }
        ],
        "pnpm": [
          {
            "op": "updateJSON",
            "targetSrc": "./command.config.json",
            "path": "packageManager",
            "value": "pnpm"
          }
        ],
        "yarn": [
          {
            "op": "updateJSON",
            "targetSrc": "./command.config.json",
            "path": "packageManager",
            "value": "yarn"
          }
        ]
      }
    }
  ]
}
